"","line","section_name","section_artist","song_name","artist_name","song_id"
"3638","Better go hard, girl, this your try-outs (Hey-hey-hey, hey-hey-hey)","Chorus","Lil Baby","Heyy","Lil Baby","8454545"
"3639","Hey (Hey-hey-hey)","Chorus","Lil Baby","Heyy","Lil Baby","8454545"
"3640","Everybody lit, can't put our fire out (Hey-hey-hey, hey-hey-hey)","Chorus","Lil Baby","Heyy","Lil Baby","8454545"
"3641","Hey (Hey-hey-hey)","Chorus","Lil Baby","Heyy","Lil Baby","8454545"
"3642","Soon as it pop, bro, pull that fire out (Hey-hey-hey, hey-hey-hey)","Chorus","Lil Baby","Heyy","Lil Baby","8454545"
"3643","Hey (Hey-hey-hey)","Chorus","Lil Baby","Heyy","Lil Baby","8454545"
"3644","This her first time comin' to my house (Hey-hey-hey, hey-hey-hey)","Chorus","Lil Baby","Heyy","Lil Baby","8454545"
"3645","Hey (Hey-hey-hey)","Chorus","Lil Baby","Heyy","Lil Baby","8454545"
"3646","Better go hard, girl, this your try-outs (Hey-hey-hey, hey-hey-hey)","Chorus","Lil Baby","Heyy","Lil Baby","8454545"
"3647","Hey-hey-hey, hey-hey-hey, hey-hey-hey","Outro","Lil Baby","Heyy","Lil Baby","8454545"
"3648","Hey-hey-hey, hey-hey-hey, hey-hey-hey","Outro","Lil Baby","Heyy","Lil Baby","8454545"
"3649","If you would've blinked, then I would've","Verse 1","Taylor Swift","Would’ve, Could’ve, Should’ve","Taylor Swift","8486447"
"3650","Looked away at the first glance","Verse 1","Taylor Swift","Would’ve, Could’ve, Should’ve","Taylor Swift","8486447"
"3651","If you tasted poison, you could've","Verse 1","Taylor Swift","Would’ve, Could’ve, Should’ve","Taylor Swift","8486447"
"3652","Spit me out at the first chance","Verse 1","Taylor Swift","Would’ve, Could’ve, Should’ve","Taylor Swift","8486447"
"3653","And if I was some paint, did it splatter","Verse 1","Taylor Swift","Would’ve, Could’ve, Should’ve","Taylor Swift","8486447"
"3654","On a promising grown man?","Verse 1","Taylor Swift","Would’ve, Could’ve, Should’ve","Taylor Swift","8486447"
"3655","And if I was a child, did it matter","Verse 1","Taylor Swift","Would’ve, Could’ve, Should’ve","Taylor Swift","8486447"
"3656","If you got to wash your hands?","Verse 1","Taylor Swift","Would’ve, Could’ve, Should’ve","Taylor Swift","8486447"
"3657","Ooh, all I used to do was pray","Pre-Chorus","Taylor Swift","Would’ve, Could’ve, Should’ve","Taylor Swift","8486447"
"3658","Would've, could've, should've","Pre-Chorus","Taylor Swift","Would’ve, Could’ve, Should’ve","Taylor Swift","8486447"
"3659","If you'd never looked my way","Pre-Chorus","Taylor Swift","Would’ve, Could’ve, Should’ve","Taylor Swift","8486447"
"3660","I would've stayed on my knees","Chorus","Taylor Swift","Would’ve, Could’ve, Should’ve","Taylor Swift","8486447"
"3661","And I damn sure never would've danced with the devil","Chorus","Taylor Swift","Would’ve, Could’ve, Should’ve","Taylor Swift","8486447"
"3662","At nineteen","Chorus","Taylor Swift","Would’ve, Could’ve, Should’ve","Taylor Swift","8486447"
"3663","And the God's honest truth is that the pain was heaven","Chorus","Taylor Swift","Would’ve, Could’ve, Should’ve","Taylor Swift","8486447"
"3664","And now that I'm grown, I'm scared of ghosts","Chorus","Taylor Swift","Would’ve, Could’ve, Should’ve","Taylor Swift","8486447"
"3665","Memories feel like weapons","Chorus","Taylor Swift","Would’ve, Could’ve, Should’ve","Taylor Swift","8486447"
"3666","And now that I know, I wish you'd left me wondering","Chorus","Taylor Swift","Would’ve, Could’ve, Should’ve","Taylor Swift","8486447"
"3667","If you never touched me, I would've","Verse 2","Taylor Swift","Would’ve, Could’ve, Should’ve","Taylor Swift","8486447"
"3668","Gone along with the righteous","Verse 2","Taylor Swift","Would’ve, Could’ve, Should’ve","Taylor Swift","8486447"
"3669","If I never blushed, then they could've","Verse 2","Taylor Swift","Would’ve, Could’ve, Should’ve","Taylor Swift","8486447"
"3670","Never whispered about this","Verse 2","Taylor Swift","Would’ve, Could’ve, Should’ve","Taylor Swift","8486447"
"3671","And if you never saved me from boredom","Verse 2","Taylor Swift","Would’ve, Could’ve, Should’ve","Taylor Swift","8486447"
"3672","I could've gone on as I was","Verse 2","Taylor Swift","Would’ve, Could’ve, Should’ve","Taylor Swift","8486447"
"3673","But, Lord, you made me feel important","Verse 2","Taylor Swift","Would’ve, Could’ve, Should’ve","Taylor Swift","8486447"
"3674","And then you tried to erase us","Verse 2","Taylor Swift","Would’ve, Could’ve, Should’ve","Taylor Swift","8486447"
"3675","Ooh, you're a crisis of my faith","Pre-Chorus","Taylor Swift","Would’ve, Could’ve, Should’ve","Taylor Swift","8486447"
"3676","Would've, could've, should've","Pre-Chorus","Taylor Swift","Would’ve, Could’ve, Should’ve","Taylor Swift","8486447"
"3677","If I'd only played it safe","Pre-Chorus","Taylor Swift","Would’ve, Could’ve, Should’ve","Taylor Swift","8486447"
"3678","I would've stayed on my knees","Chorus","Taylor Swift","Would’ve, Could’ve, Should’ve","Taylor Swift","8486447"
"3679","And I damn sure never would've danced with the devil","Chorus","Taylor Swift","Would’ve, Could’ve, Should’ve","Taylor Swift","8486447"
"3680","At nineteen","Chorus","Taylor Swift","Would’ve, Could’ve, Should’ve","Taylor Swift","8486447"
"3681","And the God's honest truth is that the pain was heaven","Chorus","Taylor Swift","Would’ve, Could’ve, Should’ve","Taylor Swift","8486447"
"3682","And now that I'm grown, I'm scared of ghosts","Chorus","Taylor Swift","Would’ve, Could’ve, Should’ve","Taylor Swift","8486447"
"3683","Memories feel like weapons","Chorus","Taylor Swift","Would’ve, Could’ve, Should’ve","Taylor Swift","8486447"
"3684","And now that I know, I wish you'd left me wondering","Chorus","Taylor Swift","Would’ve, Could’ve, Should’ve","Taylor Swift","8486447"
"3685","God rest my soul","Bridge","Taylor Swift","Would’ve, Could’ve, Should’ve","Taylor Swift","8486447"
"3686","I miss who I used to be","Bridge","Taylor Swift","Would’ve, Could’ve, Should’ve","Taylor Swift","8486447"
"3687","The tomb won't close","Bridge","Taylor Swift","Would’ve, Could’ve, Should’ve","Taylor Swift","8486447"
"3688","Stained glass windows in my mind","Bridge","Taylor Swift","Would’ve, Could’ve, Should’ve","Taylor Swift","8486447"
"3689","I regret you all the time","Bridge","Taylor Swift","Would’ve, Could’ve, Should’ve","Taylor Swift","8486447"
"3690","I can't let this go","Bridge","Taylor Swift","Would’ve, Could’ve, Should’ve","Taylor Swift","8486447"
"3691","I fight with you in my sleep","Bridge","Taylor Swift","Would’ve, Could’ve, Should’ve","Taylor Swift","8486447"
"3692","The wound won't close","Bridge","Taylor Swift","Would’ve, Could’ve, Should’ve","Taylor Swift","8486447"
"3693","I keep on waiting for a sign","Bridge","Taylor Swift","Would’ve, Could’ve, Should’ve","Taylor Swift","8486447"
"3694","I regret you all the time","Bridge","Taylor Swift","Would’ve, Could’ve, Should’ve","Taylor Swift","8486447"
"3695","If clarity's in death, then why won't this die?","Verse 3","Taylor Swift","Would’ve, Could’ve, Should’ve","Taylor Swift","8486447"
"3696","Years of tearing down our banners, you and I","Verse 3","Taylor Swift","Would’ve, Could’ve, Should’ve","Taylor Swift","8486447"
"3697","Living for the thrill of hitting you where it hurts","Verse 3","Taylor Swift","Would’ve, Could’ve, Should’ve","Taylor Swift","8486447"
"3698","Give me back my girlhood, it was mine first","Verse 3","Taylor Swift","Would’ve, Could’ve, Should’ve","Taylor Swift","8486447"
"3699","And I damn sure never would've danced with the devil","Chorus","Taylor Swift","Would’ve, Could’ve, Should’ve","Taylor Swift","8486447"
"3700","At nineteen","Chorus","Taylor Swift","Would’ve, Could’ve, Should’ve","Taylor Swift","8486447"
"3701","And the God's honest truth is that the pain was heaven","Chorus","Taylor Swift","Would’ve, Could’ve, Should’ve","Taylor Swift","8486447"
"3702","And now that I'm grown, I'm scared of ghosts","Chorus","Taylor Swift","Would’ve, Could’ve, Should’ve","Taylor Swift","8486447"
"3703","Memories feel like weapons","Chorus","Taylor Swift","Would’ve, Could’ve, Should’ve","Taylor Swift","8486447"
"3704","And now that I know, I wish you'd left me wondering","Chorus","Taylor Swift","Would’ve, Could’ve, Should’ve","Taylor Swift","8486447"
"3705","God rest my soul","Outro","Taylor Swift","Would’ve, Could’ve, Should’ve","Taylor Swift","8486447"
"3706","I miss who I used to be","Outro","Taylor Swift","Would’ve, Could’ve, Should’ve","Taylor Swift","8486447"
"3707","The tomb won't close","Outro","Taylor Swift","Would’ve, Could’ve, Should’ve","Taylor Swift","8486447"
"3708","Stained glass windows in my mind","Outro","Taylor Swift","Would’ve, Could’ve, Should’ve","Taylor Swift","8486447"
"3709","I regret you all the time","Outro","Taylor Swift","Would’ve, Could’ve, Should’ve","Taylor Swift","8486447"
"3710","I can't let this go","Outro","Taylor Swift","Would’ve, Could’ve, Should’ve","Taylor Swift","8486447"
"3711","I fight with you in my sleep","Outro","Taylor Swift","Would’ve, Could’ve, Should’ve","Taylor Swift","8486447"
"3712","The wound won't close","Outro","Taylor Swift","Would’ve, Could’ve, Should’ve","Taylor Swift","8486447"
"3713","I keep on waiting for a sign","Outro","Taylor Swift","Would’ve, Could’ve, Should’ve","Taylor Swift","8486447"
"3714","I regret you all the time","Outro","Taylor Swift","Would’ve, Could’ve, Should’ve","Taylor Swift","8486447"
"3715","Oh, God rest my soul","Outro","Taylor Swift","Would’ve, Could’ve, Should’ve","Taylor Swift","8486447"
"3716","I miss who I used to be","Outro","Taylor Swift","Would’ve, Could’ve, Should’ve","Taylor Swift","8486447"
"3717","The tomb won't close","Outro","Taylor Swift","Would’ve, Could’ve, Should’ve","Taylor Swift","8486447"
"3718","Stained glass windows in my mind","Outro","Taylor Swift","Would’ve, Could’ve, Should’ve","Taylor Swift","8486447"
"3719","I regret you all the time","Outro","Taylor Swift","Would’ve, Could’ve, Should’ve","Taylor Swift","8486447"
"3720","I can't let this go","Outro","Taylor Swift","Would’ve, Could’ve, Should’ve","Taylor Swift","8486447"
"3721","I fight with you in my sleep","Outro","Taylor Swift","Would’ve, Could’ve, Should’ve","Taylor Swift","8486447"
"3722","The wound won't close","Outro","Taylor Swift","Would’ve, Could’ve, Should’ve","Taylor Swift","8486447"
"3723","I keep on waiting for a sign","Outro","Taylor Swift","Would’ve, Could’ve, Should’ve","Taylor Swift","8486447"
"3724","I regret you all the time","Outro","Taylor Swift","Would’ve, Could’ve, Should’ve","Taylor Swift","8486447"
"3725","You said fuck me, and I was like, ""Cool""","Intro","Drake","I Guess It’s Fuck Me","Drake","8524045"
"3726","So now what's the problem?","Intro","Drake","I Guess It’s Fuck Me","Drake","8524045"
"3727","Don't go hiding again","Chorus","Drake","I Guess It’s Fuck Me","Drake","8524045"
"3728","Tired of asking where you been","Chorus","Drake","I Guess It’s Fuck Me","Drake","8524045"
"3729","You left so abruptly","Chorus","Drake","I Guess It’s Fuck Me","Drake","8524045"
"3730","I guess it's fuck me","Chorus","Drake","I Guess It’s Fuck Me","Drake","8524045"
"3731","Tell me, what did I do wrong?","Chorus","Drake","I Guess It’s Fuck Me","Drake","8524045"
"3732","Tell me, what did I do wrong?","Chorus","Drake","I Guess It’s Fuck Me","Drake","8524045"
"3733","Tell me, what did I do wrong?","Chorus","Drake","I Guess It’s Fuck Me","Drake","8524045"
"3734","Tell me, what did I do wrong?","Chorus","Drake","I Guess It’s Fuck Me","Drake","8524045"
"3735","Before it's over","Chorus","Drake","I Guess It’s Fuck Me","Drake","8524045"
"3736","I need you to come over once again","Chorus","Drake","I Guess It’s Fuck Me","Drake","8524045"
"3737","And before you give me closure","Chorus","Drake","I Guess It’s Fuck Me","Drake","8524045"
"3738","Need you to come a little bit closer","Chorus","Drake","I Guess It’s Fuck Me","Drake","8524045"
"3739","Still steppin' like Omega Psi Phi for mine","Verse","Drake","I Guess It’s Fuck Me","Drake","8524045"
"3740","If bein' real was a crime, I'd be doin' life","Verse","Drake","I Guess It’s Fuck Me","Drake","8524045"
"3741","Like that nigga not nicе, I don't know polite","Verse","Drake","I Guess It’s Fuck Me","Drake","8524045"
"3742","I'm the first evеr antisocial socialite","Verse","Drake","I Guess It’s Fuck Me","Drake","8524045"
"3743","The pain that I seen in my mother's eyes in 2009","Verse","Drake","I Guess It’s Fuck Me","Drake","8524045"
"3744","Have me workin' 'til it's 2049","Verse","Drake","I Guess It’s Fuck Me","Drake","8524045"
"3745","And get hate when I tell you, ""Oh, some other time""","Verse","Drake","I Guess It’s Fuck Me","Drake","8524045"
"3746","Like I really got some other time","Verse","Drake","I Guess It’s Fuck Me","Drake","8524045"
"3747","You just tell me, ""Never mind""","Verse","Drake","I Guess It’s Fuck Me","Drake","8524045"
"3748","Know I sound crazy to a lazy mind","Verse","Drake","I Guess It’s Fuck Me","Drake","8524045"
"3749","Know it'll be a different kind","Verse","Drake","I Guess It’s Fuck Me","Drake","8524045"
"3750","Shout out to the people workin' nine to five","Verse","Drake","I Guess It’s Fuck Me","Drake","8524045"
"3751","I be workin' nine to nine","Verse","Drake","I Guess It’s Fuck Me","Drake","8524045"
"3752","And the six upside down, it's a nine","Verse","Drake","I Guess It’s Fuck Me","Drake","8524045"
"3753","You already know the vibe","Verse","Drake","I Guess It’s Fuck Me","Drake","8524045"
"3754","And they leave 'cause of pride, but they comin' back every time","Verse","Drake","I Guess It’s Fuck Me","Drake","8524045"
"3755","The devils that I recognize, most of them got pretty eyes","Verse","Drake","I Guess It’s Fuck Me","Drake","8524045"
"3756","Titties and some plans of just gettin' by, that's the way they live or die","Verse","Drake","I Guess It’s Fuck Me","Drake","8524045"
"3757","Easy to judge, but, girl, who am I?","Verse","Drake","I Guess It’s Fuck Me","Drake","8524045"
"3758","Truth or dare, I'ma take a double dare","Verse","Drake","I Guess It’s Fuck Me","Drake","8524045"
"3759","Truth is a suicide","Verse","Drake","I Guess It’s Fuck Me","Drake","8524045"
"3760","I would rather live a lie, keep you on the outside","Verse","Drake","I Guess It’s Fuck Me","Drake","8524045"
"3761","Introduce you to the guys","Verse","Drake","I Guess It’s Fuck Me","Drake","8524045"
"3762","Have you throwin' up the south side like you're one of mine","Verse","Drake","I Guess It’s Fuck Me","Drake","8524045"
"3763","But you're not one of mine","Verse","Drake","I Guess It’s Fuck Me","Drake","8524045"
"3764","You belong to everybody else when you're bored in your free time","Verse","Drake","I Guess It’s Fuck Me","Drake","8524045"
"3765","Shit could make a thug cry, play it like a tough guy","Verse","Drake","I Guess It’s Fuck Me","Drake","8524045"
"3766","Couldn't even land in the Hamptons, they didn't have the stairs for the shit I fly","Verse","Drake","I Guess It’s Fuck Me","Drake","8524045"
"3767","Swear it's like a metaphor, I can't even get down from the shit I climb","Verse","Drake","I Guess It’s Fuck Me","Drake","8524045"
"3768","Can't even get down from the shit I climb","Verse","Drake","I Guess It’s Fuck Me","Drake","8524045"
"3769","Yeah, girl, you're my size","Verse","Drake","I Guess It’s Fuck Me","Drake","8524045"
"3770","Make me tell you one time","Verse","Drake","I Guess It’s Fuck Me","Drake","8524045"
"3771","We was on the front line, shit was in my bloodline","Verse","Drake","I Guess It’s Fuck Me","Drake","8524045"
"3772","Waitin' for the sunshine","Verse","Drake","I Guess It’s Fuck Me","Drake","8524045"
"3773","But the sun never shines on me, on me","Verse","Drake","I Guess It’s Fuck Me","Drake","8524045"
"3774","Sleepin' in the whip sometimes, girl, I was sleepin' upright","Verse","Drake","I Guess It’s Fuck Me","Drake","8524045"
"3775","Henny, red cup life, broski kept it tucked tight","Verse","Drake","I Guess It’s Fuck Me","Drake","8524045"
"3776","Niggas talkin' bare shit about what they gon' do to mine","Verse","Drake","I Guess It’s Fuck Me","Drake","8524045"
"3777","Aw, now their tongues tied","Verse","Drake","I Guess It’s Fuck Me","Drake","8524045"
"3778","We was smokin', watched the sun climb","Verse","Drake","I Guess It’s Fuck Me","Drake","8524045"
"3779","I would trap until my thumbs cried","Verse","Drake","I Guess It’s Fuck Me","Drake","8524045"
"3780","Tryna change it all in one line","Verse","Drake","I Guess It’s Fuck Me","Drake","8524045"
"3781","Never seen a thug cry","Verse","Drake","I Guess It’s Fuck Me","Drake","8524045"
"3782","Love, it's been a long time","Verse","Drake","I Guess It’s Fuck Me","Drake","8524045"
"3783","Bet you never seen a thug cry","Verse","Drake","I Guess It’s Fuck Me","Drake","8524045"
"3784","Hit me on my hotline","Verse","Drake","I Guess It’s Fuck Me","Drake","8524045"
"3785","And no, ma, I'm not fine at all","Verse","Drake","I Guess It’s Fuck Me","Drake","8524045"
"3786","Don't go hiding again","Chorus","Drake","I Guess It’s Fuck Me","Drake","8524045"
"3787","Tired of asking where you been","Chorus","Drake","I Guess It’s Fuck Me","Drake","8524045"
"3788","You left so abruptly","Chorus","Drake","I Guess It’s Fuck Me","Drake","8524045"
"3789","I guess it's fuck me","Chorus","Drake","I Guess It’s Fuck Me","Drake","8524045"
"3790","Tell me, what did I do wrong?","Chorus","Drake","I Guess It’s Fuck Me","Drake","8524045"
"3791","Tell me, what did I do wrong?","Chorus","Drake","I Guess It’s Fuck Me","Drake","8524045"
"3792","Tell me, what did I do wrong?","Chorus","Drake","I Guess It’s Fuck Me","Drake","8524045"
"3793","Tell me, what did I do wrong?","Chorus","Drake","I Guess It’s Fuck Me","Drake","8524045"
"3794","Before it's over","Chorus","Drake","I Guess It’s Fuck Me","Drake","8524045"
"3795","I need you to come over once again","Chorus","Drake","I Guess It’s Fuck Me","Drake","8524045"
"3796","And before you give me closure","Chorus","Drake","I Guess It’s Fuck Me","Drake","8524045"
"3797","Need you to come a little bit closer","Chorus","Drake","I Guess It’s Fuck Me","Drake","8524045"
"3798","(Vibez)","Intro","Rema","Calm Down","Rema","7689807"
"3799","Another banger","Intro","Rema","Calm Down","Rema","7689807"
"3800","Baby, calm down, calm down","Chorus","Rema","Calm Down","Rema","7689807"
"3801","Girl, this your body e put in my heart for lockdown, for lockdown, oh, lockdown","Chorus","Rema","Calm Down","Rema","7689807"
"3802","Girl, you sweet like Fanta, ooh, Fanta, ooh","Chorus","Rema","Calm Down","Rema","7689807"
"3803","If I tell you say, ""I love you"", you no dey form yanga, oh, oh, yanga, oh","Chorus","Rema","Calm Down","Rema","7689807"
"3804","No tell me no, no, no, no, woah, woah, woah, woah","Chorus","Rema","Calm Down","Rema","7689807"
"3805","Oh-oh-oh-oh-oh-oh-oh-oh-oh-oh-oh","Chorus","Rema","Calm Down","Rema","7689807"
"3806","Baby, come gimme your lo-lo-lo-lo-lo-lo-lo-lo-woah-woah-woah-woah-woah","Chorus","Rema","Calm Down","Rema","7689807"
"3807","You got me like woah-woah-woah-woah-woah-woah-woah-woah-woah","Chorus","Rema","Calm Down","Rema","7689807"
"3808","Shawty, come gimme your lo-lo-lo-lo-lo-lo-lo-lo-woah-woah-woah-woah-woah, hmm","Chorus","Rema","Calm Down","Rema","7689807"
"3809","I see this fine girl, for my party she wear yellow","Verse 1","Rema","Calm Down","Rema","7689807"
"3810","Every other girl they dey do too much but this girl mellow","Verse 1","Rema","Calm Down","Rema","7689807"
"3811","Naim, I dey find situation, I go use take tell am hello","Verse 1","Rema","Calm Down","Rema","7689807"
"3812","Finally, I find way to talk to the girl but she no wan follow","Verse 1","Rema","Calm Down","Rema","7689807"
"3813","Who you come dey form for? Woah (Mhmm)","Verse 1","Rema","Calm Down","Rema","7689807"
"3814","Why you no wan' conform? Woah (Mhmm)","Verse 1","Rema","Calm Down","Rema","7689807"
"3815","Then I start to feel her brown bum, warm (Mhmm)","Verse 1","Rema","Calm Down","Rema","7689807"
"3816","But she dey gimme small, small, woah","Verse 1","Rema","Calm Down","Rema","7689807"
"3817","I know say she sabi pass that one, one (Mhmm)","Verse 1","Rema","Calm Down","Rema","7689807"
"3818","But she feeling insecure, woah","Verse 1","Rema","Calm Down","Rema","7689807"
"3819","'Cause her friends go dey gum her like chewing gum, woah (Mhmm)","Verse 1","Rema","Calm Down","Rema","7689807"
"3820","Go dey gum her like chewing gum, wu-woah","Verse 1","Rema","Calm Down","Rema","7689807"
"3821","Baby, calm down, calm down","Chorus","Rema","Calm Down","Rema","7689807"
"3822","Girl, this your body e put in my heart for lockdown, for lockdown, oh lockdown","Chorus","Rema","Calm Down","Rema","7689807"
"3823","Girl, you sweet like Fanta, ooh, Fanta, ooh","Chorus","Rema","Calm Down","Rema","7689807"
"3824","If I tell you say, ""I love you"", you no dey form yanga oh, oh yanga oh","Chorus","Rema","Calm Down","Rema","7689807"
"3825","No tell me no, no, no, no, woah, woah, woah, woah","Chorus","Rema","Calm Down","Rema","7689807"
"3826","Oh-oh-oh-oh-oh-oh-oh-oh-oh-oh-oh","Chorus","Rema","Calm Down","Rema","7689807"
"3827","Baby, come gimme your lo-lo-lo-lo-lo-lo-lo-lo-woah-woah-woah-woah-woah","Chorus","Rema","Calm Down","Rema","7689807"
"3828","You got me like woah-woah-woah-woah-woah-woah-woah-woah-woah","Chorus","Rema","Calm Down","Rema","7689807"
"3829","Shawty, come gimme your lo-lo-lo-lo-lo-lo-lo-lo-woah-woah-woah-woah-woah, mm-hmm","Chorus","Rema","Calm Down","Rema","7689807"
"3830","As I reach my house, I say make a rest small, oh-woah (Make a rest small, oh-woah)","Verse 2","Rema","Calm Down","Rema","7689807"
"3831","As me I wake up na she dey my mind, oh-woah (Na she dey my mind, oh-woah)","Verse 2","Rema","Calm Down","Rema","7689807"
"3832","Day one, day two-wo, I no fit foc-o-us (I no fit focus)","Verse 2","Rema","Calm Down","Rema","7689807"
"3833","Na so me I call am, say make we link up, woah (I say make we link up woah)","Verse 2","Rema","Calm Down","Rema","7689807"
"3834","As I start to dey tell her how I feel, now my heart dey race","Verse 2","Rema","Calm Down","Rema","7689807"
"3835","Baby girl if you leave me, I no go love again","Verse 2","Rema","Calm Down","Rema","7689807"
"3836","Because e get many girls wey put my heart for pain","Verse 2","Rema","Calm Down","Rema","7689807"
"3837","Shebi, you feel my pain, yeah-yeah","Verse 2","Rema","Calm Down","Rema","7689807"
"3838","Baby, calm down, calm down","Chorus","Rema","Calm Down","Rema","7689807"
"3839","Girl, this your body e put in my heart for lockdown, for lockdown, oh, lockdown","Chorus","Rema","Calm Down","Rema","7689807"
"3840","Girl, you sweet like Fanta, ooh, Fanta, ooh","Chorus","Rema","Calm Down","Rema","7689807"
"3841","If I tell you say, ""I love you"", you no dey form yanga, oh yanga oh","Chorus","Rema","Calm Down","Rema","7689807"
"3842","No tell me no, no, no, no, woah, woah, woah, woah","Chorus","Rema","Calm Down","Rema","7689807"
"3843","Oh-oh-oh-oh-oh-oh-oh-oh-oh-oh-oh","Chorus","Rema","Calm Down","Rema","7689807"
"3844","Baby, come gimme your lo-lo-lo-lo-lo-lo-lo-lo-woah-woah-woah-woah-woah","Chorus","Rema","Calm Down","Rema","7689807"
"3845","You got me like woah-woah-woah-woah-woah-woah-woah-woah-woah","Chorus","Rema","Calm Down","Rema","7689807"
"3846","Shawty, come gimme your lo-lo-lo-lo-lo-lo-lo-lo-woah-woah-woah-woah-woah, mm-hmm","Chorus","Rema","Calm Down","Rema","7689807"
"3847","Hey, farmboy, keep droppin' that plow","Verse 1","Luke Bryan","Country On","Luke Bryan","8153442"
"3848","Bailin' that hay, feedin' them cows","Verse 1","Luke Bryan","Country On","Luke Bryan","8153442"
"3849","From the rooster crow 'til another long day is gone","Verse 1","Luke Bryan","Country On","Luke Bryan","8153442"
"3850","Country on","Verse 1","Luke Bryan","Country On","Luke Bryan","8153442"
"3851","Hey big rig, keep clockin' them miles","Verse 1","Luke Bryan","Country On","Luke Bryan","8153442"
"3852","Pullin' that horn, makin' us smile","Verse 1","Luke Bryan","Country On","Luke Bryan","8153442"
"3853","Rollin' that load down the road all night long","Verse 1","Luke Bryan","Country On","Luke Bryan","8153442"
"3854","Country on","Verse 1","Luke Bryan","Country On","Luke Bryan","8153442"
"3855","Hey cowboy, keep slingin' that rope","Chorus 1","Luke Bryan","Country On","Luke Bryan","8153442"
"3856","Eatin' that dirt, wearing that gold","Chorus 1","Luke Bryan","Country On","Luke Bryan","8153442"
"3857","Break a leg rodeo, but just don't break no bones","Chorus 1","Luke Bryan","Country On","Luke Bryan","8153442"
"3858","Country on","Chorus 1","Luke Bryan","Country On","Luke Bryan","8153442"
"3859","Hey barkeep, how 'bout another round?","Chorus 1","Luke Bryan","Country On","Luke Bryan","8153442"
"3860","Keep the neon lit in this crazy town","Chorus 1","Luke Bryan","Country On","Luke Bryan","8153442"
"3861","Just pour a little more","Chorus 1","Luke Bryan","Country On","Luke Bryan","8153442"
"3862","Country on","Chorus 1","Luke Bryan","Country On","Luke Bryan","8153442"
"3863","Country on","Post-Chorus","Luke Bryan","Country On","Luke Bryan","8153442"
"3864","Yeah","Post-Chorus","Luke Bryan","Country On","Luke Bryan","8153442"
"3865","Country on","Post-Chorus","Luke Bryan","Country On","Luke Bryan","8153442"
"3866","Hey fireman, boys and girls in blue","Verse 2","Luke Bryan","Country On","Luke Bryan","8153442"
"3867","We could sure use a lot more like you","Verse 2","Luke Bryan","Country On","Luke Bryan","8153442"
