"","line","section_name","section_artist","song_name","artist_name","song_id"
"2465","I don't know if he's an angel","Chorus","Lainey Wilson, HARDY & Lainey Wilson","wait in the truck","HARDY & Lainey Wilson","8328601"
"2466","'Cause angels don't do what he did","Chorus","Lainey Wilson, HARDY & Lainey Wilson","wait in the truck","HARDY & Lainey Wilson","8328601"
"2467","He was hellbent to find the man behind","Chorus","Lainey Wilson, HARDY & Lainey Wilson","wait in the truck","HARDY & Lainey Wilson","8328601"
"2468","All the whiskey scars I hid","Chorus","Lainey Wilson, HARDY & Lainey Wilson","wait in the truck","HARDY & Lainey Wilson","8328601"
"2469","I never thought my day of justice","Chorus","Lainey Wilson, HARDY & Lainey Wilson","wait in the truck","HARDY & Lainey Wilson","8328601"
"2470","Would come from a judge under his seat","Chorus","Lainey Wilson, HARDY & Lainey Wilson","wait in the truck","HARDY & Lainey Wilson","8328601"
"2471","But I knew right then I'd never get hit again when he said to me","Chorus","Lainey Wilson, HARDY & Lainey Wilson","wait in the truck","HARDY & Lainey Wilson","8328601"
"2472","""Wait in the truck","Chorus","Lainey Wilson, HARDY & Lainey Wilson","wait in the truck","HARDY & Lainey Wilson","8328601"
"2473","Just wait in the truck""","Chorus","Lainey Wilson, HARDY & Lainey Wilson","wait in the truck","HARDY & Lainey Wilson","8328601"
"2474","Well, I knocked and knocked and no one came","Verse 3","HARDY","wait in the truck","HARDY & Lainey Wilson","8328601"
"2475","So I kicked in his double-wide door","Verse 3","HARDY","wait in the truck","HARDY & Lainey Wilson","8328601"
"2476","I let the hammer drop before he got","Verse 3","HARDY","wait in the truck","HARDY & Lainey Wilson","8328601"
"2477","To that 12 he was reachin' for","Verse 3","HARDY","wait in the truck","HARDY & Lainey Wilson","8328601"
"2478","I didn't try to hide my pistol","Verse 3","HARDY","wait in the truck","HARDY & Lainey Wilson","8328601"
"2479","I didn't even try to run","Verse 3","HARDY","wait in the truck","HARDY & Lainey Wilson","8328601"
"2480","I just sat on the porch, smokin' one of his cigarettes","Verse 3","HARDY","wait in the truck","HARDY & Lainey Wilson","8328601"
"2481","And waited for the cops to come","Verse 3","HARDY","wait in the truck","HARDY & Lainey Wilson","8328601"
"2482","I don't know if he's an angel","Chorus","Lainey Wilson, HARDY & Lainey Wilson","wait in the truck","HARDY & Lainey Wilson","8328601"
"2483","'Cause angels don't do what he did","Chorus","Lainey Wilson, HARDY & Lainey Wilson","wait in the truck","HARDY & Lainey Wilson","8328601"
"2484","He was hellbent to find the man behind","Chorus","Lainey Wilson, HARDY & Lainey Wilson","wait in the truck","HARDY & Lainey Wilson","8328601"
"2485","All the whiskey scars I hid","Chorus","Lainey Wilson, HARDY & Lainey Wilson","wait in the truck","HARDY & Lainey Wilson","8328601"
"2486","I never thought my day of justice","Chorus","Lainey Wilson, HARDY & Lainey Wilson","wait in the truck","HARDY & Lainey Wilson","8328601"
"2487","Would come from a judge under his seat","Chorus","Lainey Wilson, HARDY & Lainey Wilson","wait in the truck","HARDY & Lainey Wilson","8328601"
"2488","But I knew right then I'd never get hit again when he said to me","Chorus","Lainey Wilson, HARDY & Lainey Wilson","wait in the truck","HARDY & Lainey Wilson","8328601"
"2489","""Wait in the truck","Chorus","Lainey Wilson, HARDY & Lainey Wilson","wait in the truck","HARDY & Lainey Wilson","8328601"
"2490","Just wait in the truck""","Chorus","Lainey Wilson, HARDY & Lainey Wilson","wait in the truck","HARDY & Lainey Wilson","8328601"
"2491","Whoa (Oh)","Post-Chorus","HARDY, Lainey Wilson, Both","wait in the truck","HARDY & Lainey Wilson","8328601"
"2492","Have mercy on me, Lord","Post-Chorus","HARDY, Lainey Wilson, Both","wait in the truck","HARDY & Lainey Wilson","8328601"
"2493","Have mercy on me","Post-Chorus","HARDY, Lainey Wilson, Both","wait in the truck","HARDY & Lainey Wilson","8328601"
"2494","Have mercy on me, Lord (Oh)","Post-Chorus","HARDY, Lainey Wilson, Both","wait in the truck","HARDY & Lainey Wilson","8328601"
"2495","It's been sixty months and she still comes","Bridge","HARDY","wait in the truck","HARDY & Lainey Wilson","8328601"
"2496","To see me from time to time","Bridge","HARDY","wait in the truck","HARDY & Lainey Wilson","8328601"
"2497","It was worth the price to see a brighter side","Bridge","HARDY","wait in the truck","HARDY & Lainey Wilson","8328601"
"2498","Of the girl I picked up that night","Bridge","HARDY","wait in the truck","HARDY & Lainey Wilson","8328601"
"2499","And I might be here forever","Bridge","HARDY","wait in the truck","HARDY & Lainey Wilson","8328601"
"2500","It ain't paradise, that's true","Bridge","HARDY","wait in the truck","HARDY & Lainey Wilson","8328601"
"2501","But it's a whole hell of a lot better","Bridge","HARDY","wait in the truck","HARDY & Lainey Wilson","8328601"
"2502","Than the place I sent him to","Bridge","HARDY","wait in the truck","HARDY & Lainey Wilson","8328601"
"2503","Yeah","Bridge","HARDY","wait in the truck","HARDY & Lainey Wilson","8328601"
"2504","(Have mercy, have mercy, have mercy on me)","Outro","HARDY & Lainey Wilson, Choir","wait in the truck","HARDY & Lainey Wilson","8328601"
"2505","""Wait in the truck, just wait in the truck""","Outro","HARDY & Lainey Wilson, Choir","wait in the truck","HARDY & Lainey Wilson","8328601"
"2506","(Have mercy on me, oh)","Outro","HARDY & Lainey Wilson, Choir","wait in the truck","HARDY & Lainey Wilson","8328601"
"2507","(Have mercy, have mercy, have mercy on me)","Outro","HARDY & Lainey Wilson, Choir","wait in the truck","HARDY & Lainey Wilson","8328601"
"2508","""Wait in the truck, just wait in the truck""","Outro","HARDY & Lainey Wilson, Choir","wait in the truck","HARDY & Lainey Wilson","8328601"
"2509","(Lord, have mercy)","Outro","HARDY & Lainey Wilson, Choir","wait in the truck","HARDY & Lainey Wilson","8328601"
"2510","(Have mercy, have mercy, have mercy on me)","Outro","HARDY & Lainey Wilson, Choir","wait in the truck","HARDY & Lainey Wilson","8328601"
"2511","(Have mercy on me, Lord, have mercy on me)","Outro","HARDY & Lainey Wilson, Choir","wait in the truck","HARDY & Lainey Wilson","8328601"
"2512","(Have mercy, have mercy, have mercy on me)","Outro","HARDY & Lainey Wilson, Choir","wait in the truck","HARDY & Lainey Wilson","8328601"
"2513","(Have mercy on me, Lord, have mercy on me)","Outro","HARDY & Lainey Wilson, Choir","wait in the truck","HARDY & Lainey Wilson","8328601"
"2514","(Have mercy, have mercy, have mercy on me)","Outro","HARDY & Lainey Wilson, Choir","wait in the truck","HARDY & Lainey Wilson","8328601"
"2515","""Wait in the truck, just wait in the truck""","Outro","HARDY & Lainey Wilson, Choir","wait in the truck","HARDY & Lainey Wilson","8328601"
"2516","(I need You to have mercy, oh, have mercy)","Outro","HARDY & Lainey Wilson, Choir","wait in the truck","HARDY & Lainey Wilson","8328601"
"2517","(Have mercy, have mercy, have mercy on me)","Outro","HARDY & Lainey Wilson, Choir","wait in the truck","HARDY & Lainey Wilson","8328601"
"2518","""Wait in the truck, just wait in the truck""","Outro","HARDY & Lainey Wilson, Choir","wait in the truck","HARDY & Lainey Wilson","8328601"
"2519","(Please have mercy, please have mercy)","Outro","HARDY & Lainey Wilson, Choir","wait in the truck","HARDY & Lainey Wilson","8328601"
"2520","(Wake up, F1LTHY)","Intro","Drake","Jumbotron Shit Poppin","Drake","8524051"
"2521","Yeah","Intro","Drake","Jumbotron Shit Poppin","Drake","8524051"
"2522","We ain't even out in Turks, she finna take sand","Chorus","Drake","Jumbotron Shit Poppin","Drake","8524051"
"2523","Ridin' 'round with F&N, we like to hold hands","Chorus","Drake","Jumbotron Shit Poppin","Drake","8524051"
"2524","(Oogie Mane he killed it) Boat was too sipped out, he ain't leave the bed","Chorus","Drake","Jumbotron Shit Poppin","Drake","8524051"
"2525","Damn, they dipped a pint of TEC in a Code Red","Chorus","Drake","Jumbotron Shit Poppin","Drake","8524051"
"2526","If I tell this bitch to pull up, she gon' moped it","Chorus","Drake","Jumbotron Shit Poppin","Drake","8524051"
"2527","My dawg, he don't smoke on shit, unless it's unleaded","Chorus","Drake","Jumbotron Shit Poppin","Drake","8524051"
"2528","I don't back and forth over no net, so just go on and dead it","Chorus","Drake","Jumbotron Shit Poppin","Drake","8524051"
"2529","See me when you see me, if it's smoke, dawg, you unleash it","Chorus","Drake","Jumbotron Shit Poppin","Drake","8524051"
"2530","Thick Moroccan bitch, this my fav', I'ma go on and beat it","Verse","Drake","Jumbotron Shit Poppin","Drake","8524051"
"2531","Lookin' in the mirror, kiss my face, I'm too conceited","Verse","Drake","Jumbotron Shit Poppin","Drake","8524051"
"2532","Send a girl home, call another, dawg, I'm too slime","Verse","Drake","Jumbotron Shit Poppin","Drake","8524051"
"2533","She ain't wanna eat it on her first day, it's haram","Verse","Drake","Jumbotron Shit Poppin","Drake","8524051"
"2534","I don't fuck with drugs, poppin' X for the first time","Verse","Drake","Jumbotron Shit Poppin","Drake","8524051"
"2535","That shit kicked in, like a two-time world champ","Verse","Drake","Jumbotron Shit Poppin","Drake","8524051"
"2536","Booted up, that shit hit up and down, like a skate-ramp","Verse","Drake","Jumbotron Shit Poppin","Drake","8524051"
"2537","She vapin' in my room, that shit lit up like a glow-lamp","Verse","Drake","Jumbotron Shit Poppin","Drake","8524051"
"2538","Who want smoke? Okay, cool, it's they whole camp","Verse","Drake","Jumbotron Shit Poppin","Drake","8524051"
"2539","Big shit popper, we the ones to get your shirt damp","Verse","Drake","Jumbotron Shit Poppin","Drake","8524051"
"2540","Niggas try to take a nigga spot, now it's too cramped","Verse","Drake","Jumbotron Shit Poppin","Drake","8524051"
"2541","Up, 8AM, geekin' hard, I'm a real vamp","Verse","Drake","Jumbotron Shit Poppin","Drake","8524051"
"2542","These niggas got me fucked up, dawg, I'm too amped","Verse","Drake","Jumbotron Shit Poppin","Drake","8524051"
"2543","Hmm-hmm, make this bitch lick me like a mail stamp","Verse","Drake","Jumbotron Shit Poppin","Drake","8524051"
"2544","Hmm-hmm, strapped up, fuck it, I'ma die lit","Verse","Drake","Jumbotron Shit Poppin","Drake","8524051"
"2545","Too slime, posted at the crib in a snake pit","Verse","Drake","Jumbotron Shit Poppin","Drake","8524051"
"2546","Every time I tell you how I feel, I don't fake shit","Verse","Drake","Jumbotron Shit Poppin","Drake","8524051"
"2547","Brr, brr, brr, brr, brr, brr, brr, brr (Bih)","Verse","Drake","Jumbotron Shit Poppin","Drake","8524051"
"2548","Brr, brr, brr, brr, brr, brr, okay","Verse","Drake","Jumbotron Shit Poppin","Drake","8524051"
"2549","Everybody got a stick, we don't run fades","Verse","Drake","Jumbotron Shit Poppin","Drake","8524051"
"2550","We ain't even out in Turks, she finna take sand","Chorus","Drake","Jumbotron Shit Poppin","Drake","8524051"
"2551","Ridin' 'round with F&N, we like to hold hands","Chorus","Drake","Jumbotron Shit Poppin","Drake","8524051"
"2552","(Oogie Mane he killed it) Boat was too sipped out, he ain't leave the bed","Chorus","Drake","Jumbotron Shit Poppin","Drake","8524051"
"2553","Damn, they dipped a pint of TEC in a Code Red","Chorus","Drake","Jumbotron Shit Poppin","Drake","8524051"
"2554","If I tell this bitch to pull up, she gon' moped it","Chorus","Drake","Jumbotron Shit Poppin","Drake","8524051"
"2555","My dawg, he don't smoke on shit, unless it's unleaded","Chorus","Drake","Jumbotron Shit Poppin","Drake","8524051"
"2556","I don't back and forth over no net, so just go on and dead it","Chorus","Drake","Jumbotron Shit Poppin","Drake","8524051"
"2557","See me when you see me, if it's smoke, dawg, you unleash it","Chorus","Drake","Jumbotron Shit Poppin","Drake","8524051"
"2558","I'm supposed to mow the grass today","Verse 1","Thomas Rhett","Half Of Me","Thomas Rhett","7590228"
"2559","I'm supposed to fix the fence","Verse 1","Thomas Rhett","Half Of Me","Thomas Rhett","7590228"
"2560","But with the sun beaten down on me","Verse 1","Thomas Rhett","Half Of Me","Thomas Rhett","7590228"
"2561","It's hard to make it make sense","Verse 1","Thomas Rhett","Half Of Me","Thomas Rhett","7590228"
"2562","Half of me wants a cold beer","Chorus","Thomas Rhett","Half Of Me","Thomas Rhett","7590228"
"2563","Yeah, that's the cold hard truth","Chorus","Thomas Rhett","Half Of Me","Thomas Rhett","7590228"
"2564","And with the frigerator stocked full of 'em","Chorus","Thomas Rhett","Half Of Me","Thomas Rhett","7590228"
"2565","Tell me what's a boy to do?","Chorus","Thomas Rhett","Half Of Me","Thomas Rhett","7590228"
"2566","I ain't even tryna fight it, it's already been decided","Chorus","Thomas Rhett","Half Of Me","Thomas Rhett","7590228"
"2567","The sky and the mountains are blue","Chorus","Thomas Rhett","Half Of Me","Thomas Rhett","7590228"
"2568","Half of me wants a cold beer","Chorus","Thomas Rhett","Half Of Me","Thomas Rhett","7590228"
"2569","And the other half does too","Chorus","Thomas Rhett","Half Of Me","Thomas Rhett","7590228"
"2570","Yeah, I kinda need to wash my truck","Verse 2","Riley Green","Half Of Me","Thomas Rhett","7590228"
"2571","But hell, I kinda dont care","Verse 2","Riley Green","Half Of Me","Thomas Rhett","7590228"
"2572","I think old Alan Jackson said it best","Verse 2","Riley Green","Half Of Me","Thomas Rhett","7590228"
"2573","""It's five o'clock somewhеre""","Verse 2","Riley Green","Half Of Me","Thomas Rhett","7590228"
"2574","Half of me wants a cold beer","Chorus","Riley Green","Half Of Me","Thomas Rhett","7590228"
"2575","Yeah, that's thе cold hard truth","Chorus","Riley Green","Half Of Me","Thomas Rhett","7590228"
"2576","And with the 'frigerator stocked full of 'em","Chorus","Riley Green","Half Of Me","Thomas Rhett","7590228"
"2577","Tell me what's a boy to do?","Chorus","Riley Green","Half Of Me","Thomas Rhett","7590228"
"2578","I ain't even tryna fight it, it's already been decided","Chorus","Riley Green","Half Of Me","Thomas Rhett","7590228"
"2579","The sky and the mountains are blue","Chorus","Riley Green","Half Of Me","Thomas Rhett","7590228"
"2580","Half of me wants a cold beer","Chorus","Riley Green","Half Of Me","Thomas Rhett","7590228"
"2581","Yeah, the other half does too","Chorus","Riley Green","Half Of Me","Thomas Rhett","7590228"
"2582","Yeah, yeah","Bridge","Thomas Rhett & Riley Green","Half Of Me","Thomas Rhett","7590228"
"2583","Half of me wants a cold beer","Bridge","Thomas Rhett & Riley Green","Half Of Me","Thomas Rhett","7590228"
"2584","If I did what I should be doin' but then that would really ruin all the fun, yeah","Bridge","Thomas Rhett & Riley Green","Half Of Me","Thomas Rhett","7590228"
"2585","There's a world of bad decisions out there, but this ain't one","Bridge","Thomas Rhett & Riley Green","Half Of Me","Thomas Rhett","7590228"
"2586","'Cause half of me wants a cold, cold beer","Chorus","Thomas Rhett & Riley Green","Half Of Me","Thomas Rhett","7590228"
"2587","Yeah, that's the cold hard truth (Yeah, it is)","Chorus","Thomas Rhett & Riley Green","Half Of Me","Thomas Rhett","7590228"
"2588","And with the 'frigerator stocked full of 'em","Chorus","Thomas Rhett & Riley Green","Half Of Me","Thomas Rhett","7590228"
"2589","Tell me, what's a boy to do?","Chorus","Thomas Rhett & Riley Green","Half Of Me","Thomas Rhett","7590228"
"2590","I ain't even tryna fight it, it's already been decided","Chorus","Thomas Rhett & Riley Green","Half Of Me","Thomas Rhett","7590228"
"2591","The sky and the mountains are blue","Chorus","Thomas Rhett & Riley Green","Half Of Me","Thomas Rhett","7590228"
"2592","Half of me wants a cold beer","Chorus","Thomas Rhett & Riley Green","Half Of Me","Thomas Rhett","7590228"
"2593","And the other half does too","Chorus","Thomas Rhett & Riley Green","Half Of Me","Thomas Rhett","7590228"
"2594","Yeah, half of me wants a cold, cold beer","Post-Chorus","Riley Green & Thomas Rhett","Half Of Me","Thomas Rhett","7590228"
"2595","The other half wants two","Post-Chorus","Riley Green & Thomas Rhett","Half Of Me","Thomas Rhett","7590228"
"2596","Woo-hoo!","Outro","Riley Green","Half Of Me","Thomas Rhett","7590228"
"2597","That sounds good, but I can't tell if that's your end or not","Outro","Riley Green","Half Of Me","Thomas Rhett","7590228"
"2598","Heard you moved out to South Carolina","Verse 1","Bailey Zimmerman","Fall In Love","Bailey Zimmerman","7692581"
"2599","Just like you always said we would","Verse 1","Bailey Zimmerman","Fall In Love","Bailey Zimmerman","7692581"
"2600","Packed your bags in that old 4Runner","Verse 1","Bailey Zimmerman","Fall In Love","Bailey Zimmerman","7692581"
"2601","That I bought you when things were good","Verse 1","Bailey Zimmerman","Fall In Love","Bailey Zimmerman","7692581"
"2602","I'm glad to see the stop sign didn't hit ya","Verse 1","Bailey Zimmerman","Fall In Love","Bailey Zimmerman","7692581"
"2603","Bring you back to your senses","Verse 1","Bailey Zimmerman","Fall In Love","Bailey Zimmerman","7692581"
"2604","Oh, it waved you gone, goodbye","Verse 1","Bailey Zimmerman","Fall In Love","Bailey Zimmerman","7692581"
"2605","Yeah, it waved you gone, goodbye","Verse 1","Bailey Zimmerman","Fall In Love","Bailey Zimmerman","7692581"
"2606","I heard you found yourself a brand new man","Verse 2","Bailey Zimmerman","Fall In Love","Bailey Zimmerman","7692581"
"2607","Put a rock on your finger and he vowed you a second chance","Verse 2","Bailey Zimmerman","Fall In Love","Bailey Zimmerman","7692581"
"2608","Built a house right by the coast","Verse 2","Bailey Zimmerman","Fall In Love","Bailey Zimmerman","7692581"
"2609","That ocean view is beautiful, but baby, I just want you to know","Verse 2","Bailey Zimmerman","Fall In Love","Bailey Zimmerman","7692581"
"2610","He don't know you like I did","Verse 2","Bailey Zimmerman","Fall In Love","Bailey Zimmerman","7692581"
"2611","Money talks, but I ain't buyin'","Verse 2","Bailey Zimmerman","Fall In Love","Bailey Zimmerman","7692581"
"2612","'Cause love's a smoke ring wrapped around your finger","Chorus","Bailey Zimmerman","Fall In Love","Bailey Zimmerman","7692581"
"2613","One second, it's a blessin', and the next, it's already gone","Chorus","Bailey Zimmerman","Fall In Love","Bailey Zimmerman","7692581"
"2614","A broken heart, I'm a walkin' testimony","Chorus","Bailey Zimmerman","Fall In Love","Bailey Zimmerman","7692581"
"2615","My confession is a lesson that I'm pourin' out in this song","Chorus","Bailey Zimmerman","Fall In Love","Bailey Zimmerman","7692581"
"2616","Oh-woah-woah, oh-woah-woah","Chorus","Bailey Zimmerman","Fall In Love","Bailey Zimmerman","7692581"
"2617","You don't wanna fall in love","Chorus","Bailey Zimmerman","Fall In Love","Bailey Zimmerman","7692581"
"2618","Oh-woah-woah, oh-woah-woah","Chorus","Bailey Zimmerman","Fall In Love","Bailey Zimmerman","7692581"
"2619","You don't wanna fall in love","Chorus","Bailey Zimmerman","Fall In Love","Bailey Zimmerman","7692581"
"2620","I seen your mama walkin' out the county market","Bridge","Bailey Zimmerman","Fall In Love","Bailey Zimmerman","7692581"
"2621","And I thought to ask her how she's been","Bridge","Bailey Zimmerman","Fall In Love","Bailey Zimmerman","7692581"
"2622","Said she's missin' ya and tried to go convincin' ya","Bridge","Bailey Zimmerman","Fall In Love","Bailey Zimmerman","7692581"
"2623","Not to settle down with him","Bridge","Bailey Zimmerman","Fall In Love","Bailey Zimmerman","7692581"
"2624","She ain't wrong, the whole town knows it","Bridge","Bailey Zimmerman","Fall In Love","Bailey Zimmerman","7692581"
"2625","You had a bed of roses, but girl, you couldn't walk that line","Bridge","Bailey Zimmerman","Fall In Love","Bailey Zimmerman","7692581"
"2626","You can act like you're doin' fine","Bridge","Bailey Zimmerman","Fall In Love","Bailey Zimmerman","7692581"
"2627","'Cause love's a smoke ring wrapped around your finger","Chorus","Bailey Zimmerman","Fall In Love","Bailey Zimmerman","7692581"
"2628","One second, it's a blessin', and the next, it's already gone","Chorus","Bailey Zimmerman","Fall In Love","Bailey Zimmerman","7692581"
"2629","A broken heart, I'm a walkin' testimony","Chorus","Bailey Zimmerman","Fall In Love","Bailey Zimmerman","7692581"
"2630","My confession is a lesson that I'm pourin' out in this song","Chorus","Bailey Zimmerman","Fall In Love","Bailey Zimmerman","7692581"
"2631","Oh-woah-woah, oh-woah-woah","Chorus","Bailey Zimmerman","Fall In Love","Bailey Zimmerman","7692581"
"2632","You don't wanna fall in love","Chorus","Bailey Zimmerman","Fall In Love","Bailey Zimmerman","7692581"
"2633","Oh-woah-woah, oh-woah-woah","Chorus","Bailey Zimmerman","Fall In Love","Bailey Zimmerman","7692581"
"2634","You don't wanna fall in love","Chorus","Bailey Zimmerman","Fall In Love","Bailey Zimmerman","7692581"
"2635","'Cause love's a smoke ring wrapped around your finger","Chorus","Bailey Zimmerman","Fall In Love","Bailey Zimmerman","7692581"
"2636","One second, it's a blessin', and the next, it's already gone","Chorus","Bailey Zimmerman","Fall In Love","Bailey Zimmerman","7692581"
"2637","A broken heart, I'm a walkin' testimony","Chorus","Bailey Zimmerman","Fall In Love","Bailey Zimmerman","7692581"
"2638","My confession is a lesson that I'm pourin' out in this song","Chorus","Bailey Zimmerman","Fall In Love","Bailey Zimmerman","7692581"
"2639","Oh-woah-woah, oh-woah-woah","Chorus","Bailey Zimmerman","Fall In Love","Bailey Zimmerman","7692581"
"2640","You don't wanna fall in love","Chorus","Bailey Zimmerman","Fall In Love","Bailey Zimmerman","7692581"
"2641","Oh-woah-woah, oh-woah-woah","Chorus","Bailey Zimmerman","Fall In Love","Bailey Zimmerman","7692581"
"2642","You don't wanna fall in love","Chorus","Bailey Zimmerman","Fall In Love","Bailey Zimmerman","7692581"
"2643","Oh-woah-woah, oh-woah-woah","Chorus","Bailey Zimmerman","Fall In Love","Bailey Zimmerman","7692581"
"2644","You don't wanna fall in love","Chorus","Bailey Zimmerman","Fall In Love","Bailey Zimmerman","7692581"
"2645","Oh-woah-woah, oh-woah-woah","Chorus","Bailey Zimmerman","Fall In Love","Bailey Zimmerman","7692581"
"2646","Heard you moved out to South Carolina","Outro","Bailey Zimmerman","Fall In Love","Bailey Zimmerman","7692581"
"2647","Just like you always said we would","Outro","Bailey Zimmerman","Fall In Love","Bailey Zimmerman","7692581"
"2648","Kiss me dangerous","Verse 1","SZA","Shirt","SZA","6337925"
"2649","Been so lost without you all around me","Verse 1","SZA","Shirt","SZA","6337925"
"2650","Get anxious","Verse 1","SZA","Shirt","SZA","6337925"
"2651","Lead me, don't look back","Verse 1","SZA","Shirt","SZA","6337925"
"2652","It's all about you","Verse 1","SZA","Shirt","SZA","6337925"
"2653","In the dark right now","Pre-Chorus","SZA","Shirt","SZA","6337925"
"2654","Feelin' lost, but I like it","Pre-Chorus","SZA","Shirt","SZA","6337925"
"2655","Comfort in my sins and all about me","Pre-Chorus","SZA","Shirt","SZA","6337925"
"2656","All I got right now","Pre-Chorus","SZA","Shirt","SZA","6337925"
"2657","Feel the taste of resentment","Pre-Chorus","SZA","Shirt","SZA","6337925"
"2658","Simmer in my skin, it's all about","Pre-Chorus","SZA","Shirt","SZA","6337925"
"2659","Bloodstain on my shirt","Chorus","SZA","Shirt","SZA","6337925"
"2660","New bitch on my nerves","Chorus","SZA","Shirt","SZA","6337925"
"2661","Old nigga got curved","Chorus","SZA","Shirt","SZA","6337925"
"2662","Goin' back on my word","Chorus","SZA","Shirt","SZA","6337925"
"2663","Damn, bitch, you so thirsty","Chorus","SZA","Shirt","SZA","6337925"
"2664","Still don't know my worth","Chorus","SZA","Shirt","SZA","6337925"
"2665","Still stressin' perfection","Chorus","SZA","Shirt","SZA","6337925"
"2666","Let you all in my mental","Chorus","SZA","Shirt","SZA","6337925"
"2667","Got me lookin' too desperate","Chorus","SZA","Shirt","SZA","6337925"
"2668","Damn (You ain't deserve)","Chorus","SZA","Shirt","SZA","6337925"
"2669","Broad day, sunshine","Verse 2","SZA","Shirt","SZA","6337925"
"2670","I'll find a way to fuck it up still","Verse 2","SZA","Shirt","SZA","6337925"
"2671","Can't cry about the shit that I can't change","Verse 2","SZA","Shirt","SZA","6337925"
"2672","Just my mind","Verse 2","SZA","Shirt","SZA","6337925"
"2673","Gotta get outta here","Verse 2","SZA","Shirt","SZA","6337925"
"2674","Tough crowd, hate it","Verse 2","SZA","Shirt","SZA","6337925"
"2675","Can't stay","Verse 2","SZA","Shirt","SZA","6337925"
"2676","In the dark right now","Pre-Chorus","SZA","Shirt","SZA","6337925"
"2677","Feelin' lost, but I like it","Pre-Chorus","SZA","Shirt","SZA","6337925"
"2678","Comfort in my sins and all about me ","Pre-Chorus","SZA","Shirt","SZA","6337925"
"2679","All I got right now","Pre-Chorus","SZA","Shirt","SZA","6337925"
"2680","Feel the tastе of resentment ","Pre-Chorus","SZA","Shirt","SZA","6337925"
"2681","Simmеr in my skin, it's all about","Pre-Chorus","SZA","Shirt","SZA","6337925"
"2682","Bloodstain on my shirt","Chorus","SZA","Shirt","SZA","6337925"
"2683","New bitch on my nerves","Chorus","SZA","Shirt","SZA","6337925"
"2684","Old nigga got curved","Chorus","SZA","Shirt","SZA","6337925"
"2685","Goin' back on my word","Chorus","SZA","Shirt","SZA","6337925"
"2686","Damn, bitch, you so thirsty","Chorus","SZA","Shirt","SZA","6337925"
"2687","Still don't know my worth","Chorus","SZA","Shirt","SZA","6337925"
"2688","Still stressin' perfection","Chorus","SZA","Shirt","SZA","6337925"
"2689","Let you all in my mental","Chorus","SZA","Shirt","SZA","6337925"
"2690","Got me lookin' too desperate ","Chorus","SZA","Shirt","SZA","6337925"
"2691","Damn","Chorus","SZA","Shirt","SZA","6337925"
"2692","It's what you say and how you do me","Bridge","SZA","Shirt","SZA","6337925"
"2693","How I'm 'posed to trust, baby? 'Posed to love?","Bridge","SZA","Shirt","SZA","6337925"
"2694","It ain't 'posed to hurt this way","Bridge","SZA","Shirt","SZA","6337925"
